{
  "schemaVersion": "1.0",
  "runId": "run-20260926-101500-a1b2c3d",
  "snapshotId": "aabbccdd11223344556677889900aabbccdd1122",
  "agent": "documentation",
  "status": "completed",
  "statusReason": null,
  "startedAt": "2026-09-26T10:15:04.000Z",
  "finishedAt": "2026-09-26T10:15:55.000Z",
  "durationMs": 51000,
  "findings": [],
  "limitations": [
    "Only files listed in context.json relevantDocs were reviewed."
  ],
  "execution": null
}
