{
  "schemaVersion": "1.0",
  "runId": "run-20260926-101500-a1b2c3d",
  "snapshotId": "aabbccdd11223344556677889900aabbccdd1122",
  "agent": "code-review",
  "status": "completed",
  "statusReason": null,
  "startedAt": "2026-09-26T10:15:03.000Z",
  "finishedAt": "2026-09-26T10:15:41.000Z",
  "durationMs": 38000,
  "findings": [],
  "limitations": [
    "Did not analyse third-party library code."
  ],
  "execution": null
}
